{"$schema":"https://json-schema.org/draft/2020-12/schema","$id":"dawn.editorial-world.v1","title":"Dawn Editorial World v1","type":"object","required":["schema","id","kind","canonicalRefs"],"properties":{"schema":{"const":"dawn.editorial-world.v1"},"id":{"type":"string"},"kind":{"enum":["morning-star","curated-collection","spectrum-editorial"]},"title":{"type":"string"},"dek":{"type":"string"},"canonicalRefs":{"type":"array","items":{"type":"string"},"uniqueItems":true},"sections":{"type":"array","items":{"type":"object","required":["id","canonicalRefs"],"properties":{"id":{"type":"string"},"title":{"type":"string"},"note":{"type":"string"},"canonicalRefs":{"type":"array","items":{"type":"string"},"uniqueItems":true}},"additionalProperties":false}},"contextPatch":{"type":"object"},"editorial":{"type":"object"}},"additionalProperties":false}