{"schema":"dawn.editorial-world.v1","id":"spectrum-second-temple","kind":"spectrum-editorial","title":"第二聖殿 · 光譜","dek":"不是另一套館藏，而是同一批 canonical Works 在歷史、耶路撒冷、新約背景與文獻入口之間的編輯光譜。","canonicalRefs":["dawn:4ef73b08ef18424f1900","dawn:157e63ed1adf50df2385","dawn:31fe2c84a38bcc616224","dawn:e22023d9b12b872bf9ee"],"sections":[{"id":"history","title":"歷史","note":"以第二聖殿時期的歷史入口觀看同一批 Works。","canonicalRefs":["dawn:4ef73b08ef18424f1900","dawn:31fe2c84a38bcc616224"]},{"id":"jerusalem","title":"耶路撒冷","note":"把城市與聖殿作為閱讀座標，不建立第二套身份。","canonicalRefs":["dawn:157e63ed1adf50df2385"]},{"id":"new-testament-background","title":"新約背景","note":"從背景脈絡接近新約世界。","canonicalRefs":["dawn:e22023d9b12b872bf9ee"]}],"contextPatch":{"anchors":["concept:second-temple"],"semanticIntent":"editorial-spectrum","ordering":"editorial"},"editorial":{"authority":"Dawn Editorial","projection":"spectrum","identityOwner":"canonical"}}